{
  "rubric_version": "1.0.0",
  "source": {
    "title": "FAIR Data Maturity Model. Specification and Guidelines",
    "version": "1.0",
    "doi": "10.15497/rda00050",
    "licence": "CC-BY-4.0"
  },
  "attribution": "Indicator identifiers and titles from: FAIR Data Maturity Model Working Group (2020). FAIR Data Maturity Model. Specification and Guidelines. Research Data Alliance. doi:10.15497/rda00050. Licensed CC BY 4.0 (https://creativecommons.org/licenses/by/4.0/). File-header interpretations are adaptations by FAIR-bioHeaders and are not endorsed by the RDA.",
  "indicators": [
    {
      "id": "RDA-F1-01M",
      "title": "Metadata is identified by a persistent identifier",
      "principle": "F1",
      "priority": "essential",
      "target": "metadata",
      "assessability": "not_applicable",
      "reason": "embedded-metadata",
      "interpretation": "Adapted: an embedded header has no identity apart from the file that carries it; the file's own identity is assessed under RDA-F1-01D and RDA-F1-02D. A separate metadata record is a repository-level matter.",
      "guideline_item": "out-of-scope"
    },
    {
      "id": "RDA-F1-01D",
      "title": "Data is identified by a persistent identifier",
      "principle": "F1",
      "priority": "essential",
      "target": "data",
      "assessability": "offline",
      "interpretation": "Adapted: the header states an identifier of this file's own data in a scheme of the pinned identifier-scheme table that is flagged persistent (DOI, versioned INSDC/RefSeq assembly accession, registered CURIE). Names such as GRCh38 are not identifiers, and an accession of the genome that a derived file annotates is credited under RDA-I3-04M, not here.",
      "conditions": [
        {
          "id": "identifier-stated",
          "concept": "data-identifier"
        },
        {
          "id": "persistent-scheme",
          "concept": "data-identifier",
          "form": "registered-id"
        }
      ],
      "evidenced_when": {
        "any_of": [
          "persistent-scheme"
        ]
      },
      "partial_when": "any",
      "online_upgrade": true,
      "guideline_item": "G1",
      "suggestions": {
        "fair-bioheaders": {
          "text": "State a persistent identifier of this file's own data, in a registered scheme.",
          "line": "#~identifier: [<persistent identifier of this file, e.g. doi:10.5281/zenodo.6762549>]"
        },
        "gff3-pragma": {
          "text": "State a persistent identifier of this file's own data, in a registered scheme.",
          "line": "#!identifier <persistent identifier of this file, e.g. doi:10.5281/zenodo.6762549>"
        },
        "vcf-meta": {
          "text": "State a persistent identifier of this file's own data, in a registered scheme.",
          "line": "##identifier=<persistent identifier of this file, e.g. doi:10.5281/zenodo.6762549>"
        },
        "gaf": {
          "text": "State a persistent identifier of this file's own data, in a registered scheme.",
          "line": "!identifier: <persistent identifier of this file, e.g. doi:10.5281/zenodo.6762549>"
        }
      }
    },
    {
      "id": "RDA-F1-02M",
      "title": "Metadata is identified by a globally unique identifier",
      "principle": "F1",
      "priority": "essential",
      "target": "metadata",
      "assessability": "not_applicable",
      "reason": "embedded-metadata",
      "interpretation": "Adapted: as RDA-F1-01M: the header shares the identity of its file.",
      "guideline_item": "out-of-scope"
    },
    {
      "id": "RDA-F1-02D",
      "title": "Data is identified by a globally unique identifier",
      "principle": "F1",
      "priority": "essential",
      "target": "data",
      "assessability": "offline",
      "interpretation": "Adapted: the header states a globally unique identifier of this file's data: an identifier in a registered scheme, or a content digest in a defined algorithm (FHR checksum, SeqCol digest). A per-record MD5 in the first FASTA defline is record-level evidence and gives at most partial credit.",
      "conditions": [
        {
          "id": "registered-identifier",
          "concept": "data-identifier",
          "form": "registered-id"
        },
        {
          "id": "content-checksum",
          "concept": "checksum",
          "form": "fhr-checksum"
        },
        {
          "id": "seqcol-digest",
          "concept": "seqcol-id",
          "form": "seqcol-digest"
        },
        {
          "id": "record-digest",
          "concept": "record-digest",
          "form": "md5",
          "scope_allowed": [
            "file",
            "first-record"
          ]
        },
        {
          "id": "identifier-stated",
          "concept": "data-identifier"
        }
      ],
      "evidenced_when": {
        "any_of": [
          "registered-identifier",
          "content-checksum",
          "seqcol-digest",
          "record-digest"
        ]
      },
      "partial_when": "any",
      "guideline_item": "G1",
      "suggestions": {
        "fair-bioheaders": {
          "text": "State a persistent identifier of this file's own data, in a registered scheme.",
          "line": "#~identifier: [<persistent identifier of this file, e.g. doi:10.5281/zenodo.6762549>]"
        },
        "gff3-pragma": {
          "text": "State a persistent identifier of this file's own data, in a registered scheme.",
          "line": "#!identifier <persistent identifier of this file, e.g. doi:10.5281/zenodo.6762549>"
        },
        "vcf-meta": {
          "text": "State a persistent identifier of this file's own data, in a registered scheme.",
          "line": "##identifier=<persistent identifier of this file, e.g. doi:10.5281/zenodo.6762549>"
        },
        "gaf": {
          "text": "State a persistent identifier of this file's own data, in a registered scheme.",
          "line": "!identifier: <persistent identifier of this file, e.g. doi:10.5281/zenodo.6762549>"
        }
      }
    },
    {
      "id": "RDA-F2-01M",
      "title": "Rich metadata is provided to allow discovery",
      "principle": "F2",
      "priority": "essential",
      "target": "metadata",
      "assessability": "offline",
      "interpretation": "Adapted: the header carries a fixed set of six discovery elements: subject name, taxon, version, creator, date and an identifier of the data. All six are evidenced; three to five are partial.",
      "conditions": [
        {
          "id": "subject",
          "concept": "subject-name"
        },
        {
          "id": "taxon",
          "concept": "taxon"
        },
        {
          "id": "version",
          "concept": "version"
        },
        {
          "id": "creator",
          "concept": "creator"
        },
        {
          "id": "date",
          "concept": "date-created"
        },
        {
          "id": "identifier",
          "concept": "data-identifier"
        }
      ],
      "evidenced_when": "all",
      "partial_when": {
        "min": 3
      },
      "guideline_item": "G2",
      "suggestions": {
        "fair-bioheaders": {
          "text": "State the version or release of this file's data.",
          "line": "#~version: <version or release of this file's data, e.g. WS298>"
        },
        "gff3-pragma": {
          "text": "State the version or release of this file's data.",
          "line": "#!version <version or release of this file's data, e.g. WS298>"
        },
        "vcf-meta": {
          "text": "State the version or release of this file's data.",
          "line": "##version=<version or release of this file's data, e.g. WS298>"
        },
        "gaf": {
          "text": "State the version or release of this file's data.",
          "line": "!version: <version or release of this file's data, e.g. WS298>"
        }
      }
    },
    {
      "id": "RDA-F3-01M",
      "title": "Metadata includes the identifier for the data",
      "principle": "F3",
      "priority": "essential",
      "target": "metadata",
      "assessability": "offline",
      "interpretation": "Adapted: the header contains an identifier of this file's data (identifier, accession, FHR checksum or SeqCol digest) under a key whose meaning is that identifier.",
      "conditions": [
        {
          "id": "identifier",
          "concept": "data-identifier"
        },
        {
          "id": "checksum",
          "concept": "checksum",
          "form": "fhr-checksum"
        },
        {
          "id": "seqcol",
          "concept": "seqcol-id",
          "form": "seqcol-digest"
        }
      ],
      "evidenced_when": "any",
      "partial_when": "never",
      "guideline_item": "G1",
      "suggestions": {
        "fair-bioheaders": {
          "text": "State a persistent identifier of this file's own data, in a registered scheme.",
          "line": "#~identifier: [<persistent identifier of this file, e.g. doi:10.5281/zenodo.6762549>]"
        },
        "gff3-pragma": {
          "text": "State a persistent identifier of this file's own data, in a registered scheme.",
          "line": "#!identifier <persistent identifier of this file, e.g. doi:10.5281/zenodo.6762549>"
        },
        "vcf-meta": {
          "text": "State a persistent identifier of this file's own data, in a registered scheme.",
          "line": "##identifier=<persistent identifier of this file, e.g. doi:10.5281/zenodo.6762549>"
        },
        "gaf": {
          "text": "State a persistent identifier of this file's own data, in a registered scheme.",
          "line": "!identifier: <persistent identifier of this file, e.g. doi:10.5281/zenodo.6762549>"
        }
      }
    },
    {
      "id": "RDA-F4-01M",
      "title": "Metadata is offered in such a way that it can be harvested and indexed",
      "principle": "F4",
      "priority": "essential",
      "target": "metadata",
      "assessability": "not_applicable",